{
  "$schema": "https://json-schema.org/draft/2020-12/schema",
  "$id": "eval-case.schema.json",
  "title": "AI Team Eval Case",
  "type": "object",
  "required": ["id", "version", "skill", "objective", "input", "expected", "graders", "origin", "tags"],
  "properties": {
    "$schema": {"type": "string"},
    "id": {"type": "string", "pattern": "^[a-z0-9][a-z0-9-]*-[0-9]{3}$"},
    "version": {"type": "integer", "minimum": 1},
    "skill": {
      "enum": ["pbi-discovery", "impact-analysis", "environment-bootstrap", "code-review", "review-learning", "retrospective"]
    },
    "objective": {"type": "string", "minLength": 10},
    "input": {
      "type": "object",
      "required": ["task"],
      "properties": {
        "task": {"type": "string", "minLength": 1},
        "artifacts": {"type": "array", "items": {"type": "object"}}
      },
      "additionalProperties": false
    },
    "expected": {
      "type": "object",
      "required": ["must_include", "must_not_include"],
      "properties": {
        "must_include": {"type": "array", "minItems": 1, "items": {"type": "string"}},
        "must_not_include": {"type": "array", "items": {"type": "string"}},
        "required_artifacts": {"type": "array", "items": {"type": "string"}}
      },
      "additionalProperties": false
    },
    "graders": {
      "type": "array",
      "minItems": 1,
      "items": {
        "type": "object",
        "required": ["type", "criterion", "weight"],
        "properties": {
          "type": {"enum": ["structural", "human", "model", "test"]},
          "criterion": {"type": "string", "minLength": 1},
          "weight": {"type": "number", "exclusiveMinimum": 0, "maximum": 1}
        },
        "additionalProperties": false
      }
    },
    "origin": {
      "type": "object",
      "required": ["kind", "failure_mode"],
      "properties": {
        "kind": {"enum": ["baseline", "trace", "incident", "human-feedback"]},
        "failure_mode": {"type": "string", "minLength": 1},
        "trace_ids": {"type": "array", "items": {"type": "string"}}
      },
      "additionalProperties": false
    },
    "tags": {"type": "array", "items": {"type": "string"}}
  },
  "additionalProperties": false
}
